{
  "story_package": 1,
  "story": "tidewatch",
  "content_version": 1,
  "source_hash": "f7a71b473a5af99f",
  "sources": [
    "people.story",
    "tidewatch.story"
  ],
  "round": "tw:watch_started",
  "holders": [
    "player",
    "odile",
    "bram"
  ],
  "speakers": [
    {
      "id": "odile",
      "name": "Odile Marr",
      "holder": 1,
      "present": 1,
      "cooldown": 240,
      "knows": [
        0
      ],
      "at": {
        "file": 0,
        "line": 4
      }
    },
    {
      "id": "bram",
      "name": "Bram Teller",
      "holder": 2,
      "present": 2,
      "cooldown": 240,
      "knows": [
        0
      ],
      "at": {
        "file": 0,
        "line": 20
      }
    }
  ],
  "facts": [
    {
      "id": "lent_fuel",
      "ty": "bool",
      "default": 0.0,
      "scope": "run",
      "doc": "the player gave Bram two bricks from the shed for the dock lamp",
      "at": {
        "file": 0,
        "line": 36
      }
    },
    {
      "id": "promised_bram",
      "ty": "bool",
      "default": 0.0,
      "scope": "run",
      "doc": "the player told Bram they would help after the watch",
      "at": {
        "file": 0,
        "line": 37
      }
    },
    {
      "id": "kept_promise",
      "ty": "bool",
      "default": 0.0,
      "scope": "run",
      "doc": "the player came back after the watch and gave Bram the bricks",
      "at": {
        "file": 0,
        "line": 38
      }
    },
    {
      "id": "trust_bram",
      "ty": "int",
      "default": 0.0,
      "scope": "run",
      "doc": "how far Bram trusts the new hand",
      "at": {
        "file": 0,
        "line": 39
      }
    }
  ],
  "infos": [
    {
      "id": "gannet_lost",
      "doc": "Odile let the light go out the night the Gannet sank",
      "at": {
        "file": 0,
        "line": 41
      }
    },
    {
      "id": "fuel_lent",
      "doc": "the new hand gave Bram two bricks from the shed",
      "truth": 0,
      "at": {
        "file": 0,
        "line": 42
      }
    },
    {
      "id": "player_heard_gannet",
      "doc": "the new hand knows about the Gannet",
      "at": {
        "file": 0,
        "line": 44
      }
    },
    {
      "id": "odile_failing",
      "doc": "Odile's eyes are going",
      "truth": 1,
      "at": {
        "file": 0,
        "line": 45
      }
    }
  ],
  "vars": [
    {
      "kind": "fact",
      "fact": 0
    },
    {
      "kind": "query",
      "id": "scene:near_odile",
      "ty": "bool"
    },
    {
      "kind": "query",
      "id": "scene:near_bram",
      "ty": "bool"
    },
    {
      "kind": "query",
      "id": "tw:dock_lit",
      "ty": "bool"
    },
    {
      "kind": "query",
      "id": "tw:watch",
      "ty": "int"
    },
    {
      "kind": "query",
      "id": "tw:boats_late",
      "ty": "int"
    },
    {
      "kind": "query",
      "id": "tw:shed_fuel",
      "ty": "int"
    },
    {
      "kind": "query",
      "id": "tw:phase",
      "ty": "int"
    },
    {
      "kind": "fact",
      "fact": 1
    },
    {
      "kind": "knows",
      "holder": 0,
      "info": 0
    },
    {
      "kind": "fact",
      "fact": 2
    },
    {
      "kind": "fact",
      "fact": 3
    },
    {
      "kind": "knows",
      "holder": 1,
      "info": 2
    },
    {
      "kind": "knows",
      "holder": 1,
      "info": 1
    },
    {
      "kind": "query",
      "id": "tw:brazier_fuel",
      "ty": "int"
    },
    {
      "kind": "query",
      "id": "tw:secs_left",
      "ty": "int"
    },
    {
      "kind": "query",
      "id": "tw:last_safe",
      "ty": "bool"
    },
    {
      "kind": "query",
      "id": "tw:light_out",
      "ty": "bool"
    },
    {
      "kind": "query",
      "id": "tw:dark_secs",
      "ty": "int"
    },
    {
      "kind": "query",
      "id": "tw:reserve",
      "ty": "int"
    }
  ],
  "exprs": [
    "v0",
    "false",
    "v3",
    "v4 == 0",
    "v4 >= 1 && v5 == 0",
    "v5 >= 1",
    "v6 >= 2",
    "2",
    "true",
    "1",
    "-1",
    "v7 == 0 && !v8",
    "true",
    "!v9",
    "v8 && !v10 && v4 >= 1 && v7 != 1",
    "v6 >= 2",
    "2",
    "true",
    "true",
    "2",
    "-1",
    "false",
    "v11 >= 2",
    "v11 < 2",
    "v7 != 1",
    "v4 == 0",
    "v4 >= 1 && v7 == 0",
    "v7 == 2",
    "v9 && !v12",
    "v0 && !v13",
    "v4 == 1",
    "v4 == 2 && v5 == 0",
    "v4 == 2 && v5 >= 1",
    "v4 == 2 && v13",
    "v14 >= 4",
    "v15 > 3",
    "v15 > 3",
    "v1",
    "v2",
    "v10",
    "v16",
    "!v16",
    "v8 && !v10 && v2",
    "v17 * 3 + (v14 <= 1) * 2 + (v15 < 15)",
    "v7 != 1",
    "v17",
    "v14 <= 1 && v18 >= 3 && v19 > 0",
    "v15 > 15"
  ],
  "authored": [
    "lent_fuel",
    "false",
    "tw:dock_lit",
    "tw:watch == 0",
    "tw:watch >= 1 && tw:boats_late == 0",
    "tw:boats_late >= 1",
    "tw:shed_fuel >= 2",
    "2",
    "true",
    "1",
    "-1",
    "tw:phase == 0 && !promised_bram",
    "true",
    "!knows(player, gannet_lost)",
    "promised_bram && !kept_promise && tw:watch >= 1 && tw:phase != 1",
    "tw:shed_fuel >= 2",
    "2",
    "true",
    "true",
    "2",
    "-1",
    "false",
    "trust_bram >= 2",
    "trust_bram < 2",
    "tw:phase != 1",
    "tw:watch == 0",
    "tw:watch >= 1 && tw:phase == 0",
    "tw:phase == 2",
    "knows(player, gannet_lost) && !knows(odile, player_heard_gannet)",
    "lent_fuel && !knows(odile, fuel_lent)",
    "tw:watch == 1",
    "tw:watch == 2 && tw:boats_late == 0",
    "tw:watch == 2 && tw:boats_late >= 1",
    "tw:watch == 2 && knows(odile, fuel_lent)",
    "tw:brazier_fuel >= 4",
    "tw:secs_left > 3",
    "tw:secs_left > 3",
    "present(odile)",
    "present(bram)",
    "kept_promise",
    "tw:last_safe",
    "!tw:last_safe",
    "promised_bram && !kept_promise && present(bram)",
    "tw:light_out * 3 + (tw:brazier_fuel <= 1) * 2 + (tw:secs_left < 15)",
    "tw:phase != 1",
    "tw:light_out",
    "tw:brazier_fuel <= 1 && tw:dark_secs >= 3 && tw:reserve > 0",
    "tw:secs_left > 15"
  ],
  "lines": [
    {
      "id": "talk_bram/hello/l1",
      "speaker": 1,
      "text": [
        "You're the new hand? Odile said you'd be quick. Are you quick?"
      ],
      "at": {
        "file": 1,
        "line": 14
      }
    },
    {
      "id": "talk_bram/hello/l2",
      "speaker": 1,
      "text": [
        "The lamp's lit already! Was that you? It doesn't matter. It's lit."
      ],
      "cond": 2,
      "goto": {
        "line": 13
      },
      "at": {
        "file": 1,
        "line": 15
      }
    },
    {
      "id": "talk_bram/hello/l3",
      "speaker": 1,
      "text": [
        "The Wren is out there. My dad's boat. Two lamps on this coast and one of them is ours."
      ],
      "cond": 3,
      "at": {
        "file": 1,
        "line": 18
      }
    },
    {
      "id": "talk_bram/hello/l4",
      "speaker": 1,
      "text": [
        "The light held, didn't it? I watched it from here. It held."
      ],
      "cond": 4,
      "at": {
        "file": 1,
        "line": 20
      }
    },
    {
      "id": "talk_bram/hello/l5",
      "speaker": 1,
      "text": [
        "It went dark out there. I counted. Was it long? It felt long."
      ],
      "cond": 5,
      "goto": {
        "line": 5
      },
      "skip": {
        "line": 5
      },
      "at": {
        "file": 1,
        "line": 22
      }
    },
    {
      "id": "talk_bram/ask/l1",
      "speaker": 1,
      "text": [
        "The dock lamp's empty. Two bricks would light it for the Wren. Just two?"
      ],
      "choices": [
        {
          "id": "lend",
          "text": [
            "Take two. Light it."
          ],
          "cond": 6,
          "effects": [
            {
              "do": "run",
              "command": "tw:lend",
              "value": 7
            },
            {
              "do": "set",
              "fact": 0,
              "expr": 8
            },
            {
              "do": "add",
              "fact": 3,
              "expr": 9
            }
          ],
          "goto": {
            "line": 6
          },
          "refused": {
            "line": 12
          },
          "stakes": "consequential",
          "at": {
            "file": 1,
            "line": 28
          }
        },
        {
          "id": "refuse",
          "text": [
            "The brazier needs every brick."
          ],
          "effects": [
            {
              "do": "add",
              "fact": 3,
              "expr": 10
            }
          ],
          "goto": {
            "line": 7
          },
          "stakes": "consequential",
          "at": {
            "file": 1,
            "line": 34
          }
        },
        {
          "id": "later",
          "text": [
            "After the watch. I promise."
          ],
          "cond": 11,
          "effects": [
            {
              "do": "set",
              "fact": 1,
              "expr": 12
            }
          ],
          "goto": {
            "line": 8
          },
          "stakes": "consequential",
          "at": {
            "file": 1,
            "line": 38
          }
        },
        {
          "id": "why",
          "text": [
            "Why are you scared of Odile?"
          ],
          "cond": 13,
          "goto": {
            "line": 9
          },
          "stakes": "informational",
          "at": {
            "file": 1,
            "line": 43
          }
        }
      ],
      "skip": "end",
      "at": {
        "file": 1,
        "line": 27
      }
    },
    {
      "id": "talk_bram/lent/l1",
      "speaker": 1,
      "text": [
        "Two. Two is plenty. Thank you. Really."
      ],
      "goto": "end",
      "skip": "end",
      "at": {
        "file": 1,
        "line": 49
      }
    },
    {
      "id": "talk_bram/refused/l1",
      "speaker": 1,
      "text": [
        "No. No, you're right, of course you are."
      ],
      "goto": "end",
      "skip": "end",
      "at": {